{
  "slug": "5s-training",
  "name": "5S Training",
  "tagline": "Pastel minimal 5S training deck with rounded photo cards, black offset shadows, soft color pills, organic circles, and clean workshop layouts.",
  "mood": [
    "practical",
    "instructional",
    "soft",
    "organized"
  ],
  "occasion": [
    "operations training",
    "process improvement",
    "manufacturing workshop",
    "team enablement"
  ],
  "tone": [
    "clear",
    "friendly",
    "procedural",
    "calm"
  ],
  "formality": "medium",
  "density": "medium",
  "palette": {
    "bg": "#FBF7F8",
    "surface": "#FFFFFF",
    "panel": "#DDF5FF",
    "primary": "#1D1D1F",
    "accent": "#CFE7B7",
    "text": "#1D1D1F",
    "muted": "#393539",
    "line": "#1D1D1F",
    "description": "near-white canvas with black rounded type, pastel blue, mint, lavender, peach, and pale pink modules plus thick black offset shadows"
  },
  "typography": {
    "display": "Nunito Sans",
    "body": "Space Mono",
    "style": "rounded bold training headings with monospaced workshop body copy"
  },
  "scheme": "light",
  "best_for": "5S, process improvement, safety training, team enablement, and practical workshop decks that should feel clear without becoming industrially harsh.",
  "avoid_for": "Luxury decks, dark technology pitches, or formal legal and finance presentations.",
  "slide_count": 15,
  "features": {
    "navigation": true,
    "keyboard_navigation": true,
    "touch_navigation": true,
    "progress_bar": true,
    "slide_counter": true,
    "aspect_ratio": "fullscreen-responsive",
    "format": "single-file-html",
    "source_preview_slides": 15
  },
  "layouts": [
    "pastel-cover-photo",
    "overview-pills",
    "intro-photo-split",
    "what-is-5s",
    "five-step-wheel",
    "individual-step-pages",
    "checklist-grid",
    "benefit-bars",
    "learning-check",
    "closing"
  ],
  "source_inspiration": {
    "name": "SlidesCarnival 5S Training Slides",
    "url": "https://www.slidescarnival.com/template/5s-training-slides/333064",
    "notes": "Independent HTML/CSS reconstruction of the public preview sequence. It follows the pastel minimal color system, rounded photo frames, pill buttons, soft organic circles, and black offset shadows without reusing source photos."
  }
}
