{
  "slug": "airy-modern",
  "name": "Airy Modern",
  "tagline": "Spacious modern light deck with floating panels, soft periwinkle surfaces, and product-strategy pacing.",
  "mood": [
    "calm",
    "modern",
    "spacious",
    "clear"
  ],
  "occasion": [
    "product strategy",
    "customer research",
    "team update",
    "planning workshop",
    "startup pitch"
  ],
  "tone": [
    "minimal",
    "friendly",
    "considered",
    "optimistic"
  ],
  "formality": "medium",
  "density": "medium",
  "scheme": "light",
  "palette": {
    "bg": "#F6F7FF",
    "surface": "#FFFFFF",
    "panel": "#EEF2FF",
    "ink": "#182033",
    "text": "#384155",
    "muted": "#7B8497",
    "primary": "#536DFE",
    "secondary": "#8BD3FF",
    "tertiary": "#FFB84D",
    "green": "#46B885",
    "description": "Soft periwinkle-white canvas with clean indigo type, pale blue panels, and restrained amber and green accents."
  },
  "typography": {
    "display": "Plus Jakarta Sans",
    "body": "Inter",
    "style": "Rounded modern sans pairing with generous spacing."
  },
  "best_for": "Product strategy, customer research, startup updates, planning workshops, and decks that need a polished but low-pressure feel.",
  "avoid_for": "Hard-charging sales decks, dark executive briefings, or dense financial reporting.",
  "slide_count": 8,
  "features": {
    "navigation": true,
    "keyboard_navigation": true,
    "touch_navigation": true,
    "progress_bar": true,
    "slide_counter": true,
    "aspect_ratio": "fullscreen-responsive",
    "format": "single-file-html"
  },
  "layouts": [
    "floating-cover",
    "tab-agenda",
    "insight-cards",
    "quote-split",
    "customer-journey",
    "soft-bars",
    "milestone-board",
    "closing"
  ],
  "source_inspiration": {
    "name": "Light & Modern Slides for Clean Presentations",
    "url": "https://gamma.app/templates",
    "notes": "Original HTML template rebuilt from public visual direction only; not a pixel copy and does not reuse source assets."
  }
}
