{
  "slug": "modern-business-proposal",
  "name": "Modern Business Proposal",
  "tagline": "Grey modern proposal deck with wide techno headings, red emphasis words, monospaced body copy, slash marks, and dramatic device/photo blocks.",
  "mood": [
    "confident",
    "modern",
    "commercial",
    "sharp"
  ],
  "occasion": [
    "business proposal",
    "client pitch",
    "service offer",
    "project plan"
  ],
  "tone": [
    "bold",
    "techno",
    "minimal",
    "sales-led"
  ],
  "formality": "medium",
  "density": "medium",
  "palette": {
    "bg": "#D9D9D9",
    "surface": "#E4E4E4",
    "panel": "#F1F1F1",
    "primary": "#A90F19",
    "accent": "#111111",
    "text": "#050505",
    "muted": "#3D3D3D",
    "line": "#A90F19",
    "description": "cool grey canvas with black wide display type, deep red emphasis, monospaced notes, and dark editorial image blocks"
  },
  "typography": {
    "display": "Orbitron",
    "body": "Space Mono",
    "style": "wide futuristic display type with compact monospaced proposal copy"
  },
  "scheme": "light",
  "best_for": "Modern business proposals, brand-forward client pitches, productized service offers, and project plans that should feel sharp and current.",
  "avoid_for": "Conservative board reporting, warm nonprofit storytelling, or soft HR decks where the techno proposal attitude would be too hard-edged.",
  "slide_count": 25,
  "features": {
    "navigation": true,
    "keyboard_navigation": true,
    "touch_navigation": true,
    "progress_bar": true,
    "slide_counter": true,
    "aspect_ratio": "fullscreen-responsive",
    "format": "single-file-html",
    "source_preview_slides": 25
  },
  "layouts": [
    "split-photo-cover",
    "resource-icons",
    "monospace-table-of-contents",
    "project-overview",
    "objective-cards",
    "device-concept",
    "budget-grid",
    "timeline",
    "role-table",
    "risk-analysis",
    "data-board-variants"
  ],
  "source_inspiration": {
    "name": "Slidesgo Modern Business Proposal",
    "url": "https://slidesgo.com/theme/modern-business-proposal",
    "notes": "Independent HTML/CSS reconstruction of the public preview sequence. It matches the grey canvas, wide black/red typography, mono body copy, slash marks, and photo/device composition vocabulary without reusing source images."
  }
}
