{
  "slug": "b2b-sales-pitch",
  "name": "B2B Sales Pitch",
  "tagline": "Dark teal B2B sales pitch deck with lime typography, rounded photo panels, large loop ornaments, and slide-by-slide layouts matching the public source preview sequence.",
  "mood": [
    "professional",
    "confident",
    "modern",
    "sales-led"
  ],
  "occasion": [
    "B2B sales pitch",
    "SaaS proposal",
    "enterprise platform pitch",
    "go-to-market deck"
  ],
  "tone": [
    "sharp",
    "fresh",
    "corporate",
    "engaging"
  ],
  "formality": "medium-high",
  "density": "medium",
  "palette": {
    "bg": "#142127",
    "panel": "#1F3640",
    "primary": "#DCFFAD",
    "text": "#FFFFFF",
    "description": "deep teal background, darker teal rounded panels, lime headline/accent typography, and white supporting text"
  },
  "typography": {
    "display": "Helvetica Now Display style",
    "body": "Helvetica Now Display Regular style",
    "style": "large rounded neo-grotesk sales deck typography; implemented with Helvetica/Arial fallbacks for portable HTML"
  },
  "scheme": "dark",
  "best_for": "B2B SaaS and platform sales pitches that need to feel modern, confident, scalable, and visually differentiated without becoming playful.",
  "avoid_for": "Highly conservative financial or legal presentations, delicate editorial decks, or contexts where photo-led sales polish would feel too commercial.",
  "slide_count": 15,
  "features": {
    "navigation": true,
    "keyboard_navigation": true,
    "touch_navigation": true,
    "progress_bar": true,
    "slide_counter": true,
    "aspect_ratio": "fullscreen-responsive",
    "format": "single-file-html",
    "status": "accurate-candidate-replica"
  },
  "layouts": [
    "source-matched-cover",
    "source-matched-contents",
    "source-matched-status-quo",
    "source-matched-problem-opportunity",
    "source-matched-meet-platform",
    "source-matched-solution-flow",
    "source-matched-capability-circles",
    "source-matched-demo-laptop",
    "source-matched-testimonial-cards",
    "source-matched-impact-charts",
    "source-matched-next-steps",
    "source-matched-contact",
    "source-matched-resource-fonts-icons",
    "source-matched-credits",
    "source-matched-resource-shortcuts"
  ],
  "source_inspiration": {
    "name": "SlidesCarnival B2B Sales Pitch Slides",
    "url": "https://www.slidescarnival.com/template/b2b-sales-pitch-slides-2/341207",
    "notes": "Independent HTML/CSS reconstruction of the public slide-preview layout sequence. The template does not reuse source photos or proprietary presentation assets; photo areas are editable placeholders built at matching dimensions."
  }
}
