{
  "slug": "interactive-portfolio",
  "name": "Interactive Portfolio",
  "tagline": "Black portfolio deck with top-nav rhythm, organic violet shapes, carousel dots, and project-gallery layouts.",
  "mood": [
    "creative",
    "modern",
    "confident",
    "showcase"
  ],
  "occasion": [
    "portfolio review",
    "agency credentials",
    "case study",
    "creative proposal"
  ],
  "tone": [
    "visual",
    "playful",
    "bold",
    "curated"
  ],
  "formality": "medium-low",
  "density": "medium",
  "palette": {
    "bg": "#050505",
    "surface": "#101014",
    "panel": "#18181F",
    "ink": "#FFFFFF",
    "text": "#EAEAF2",
    "muted": "#A7A3B8",
    "primary": "#4D2CFF",
    "secondary": "#F0A8FF",
    "tertiary": "#FFFFFF",
    "description": "black presentation surface with electric blue and soft lavender organic shapes"
  },
  "typography": {
    "display": "Syne",
    "body": "Inter",
    "style": "wide geometric display type with simple portfolio body text"
  },
  "scheme": "dark",
  "best_for": "Creative portfolios, agency credentials, designer case studies, and visual project showcases that need movement and personality.",
  "avoid_for": "Traditional board decks, clinical reports, or information-heavy consulting work.",
  "slide_count": 6,
  "features": {
    "navigation": true,
    "keyboard_navigation": true,
    "touch_navigation": true,
    "progress_bar": true,
    "slide_counter": true,
    "aspect_ratio": "fullscreen-responsive",
    "format": "single-file-html"
  },
  "layouts": [
    "portfolio-cover",
    "nav-agenda",
    "project-grid",
    "case-study-split",
    "resume-stats",
    "closing"
  ],
  "source_inspiration": {
    "name": "Slidesgo Modern and Interactive Portfolio",
    "url": "https://slidesgo.com/theme/modern-and-interactive-portfolio",
    "notes": "Independent HTML/CSS interpretation based on public visual reference; not a pixel copy and does not reuse source assets."
  }
}
