{
  "slug": "quarterly-review-meeting",
  "name": "Quarterly Review Meeting",
  "tagline": "Cream QBR meeting deck with blocky red emphasis type, grayscale business photo panels, square grid ornaments, dark edge blocks, status charts, Gantt layouts, checklist tables, and RAID/KPI review pages.",
  "mood": [
    "businesslike",
    "structured",
    "calm",
    "editorial"
  ],
  "occasion": [
    "quarterly business review",
    "executive meeting",
    "operating review",
    "team update"
  ],
  "tone": [
    "clear",
    "measured",
    "professional",
    "direct"
  ],
  "formality": "medium-high",
  "density": "medium-high",
  "palette": {
    "bg": "#F7EEE8",
    "primary": "#CF4F59",
    "text": "#171514",
    "text_muted": "#5B5352",
    "accent_dark": "#625857",
    "description": "warm cream meeting canvas with brick-red emphasis, near-black text, muted taupe grid lines, and dark gray edge blocks"
  },
  "typography": {
    "display": "League Spartan",
    "body": "Inter",
    "style": "heavy uppercase business display type paired with clean sans body copy"
  },
  "scheme": "light",
  "best_for": "Quarterly business reviews, project review meetings, operating updates, team retrospectives, status reports, and structured executive readouts where agenda, timeline, status, checklist, KPI, and RAID slides are needed.",
  "avoid_for": "Highly playful, colorful, luxury, or image-led brand decks; the system is intentionally meeting-oriented and structured.",
  "slide_count": 15,
  "features": {
    "navigation": true,
    "keyboard_navigation": true,
    "touch_navigation": true,
    "progress_bar": true,
    "slide_counter": true,
    "aspect_ratio": "fullscreen-responsive",
    "format": "single-file-html"
  },
  "layouts": [
    "grid-photo-cover",
    "template-contents",
    "meeting-objectives",
    "four-part-agenda",
    "about-project-photo",
    "quote-photo-split",
    "section-divider",
    "gantt-project-schedule",
    "four-step-timeline",
    "checklist-table",
    "status-report-bars",
    "six-column-icon-grid",
    "kpi-dashboard",
    "raid-summary",
    "full-photo-banner"
  ],
  "source_inspiration": {
    "name": "Slidesgo Quarterly Business Review Meeting",
    "url": "https://slidesgo.com/theme/quarterly-business-review-meeting",
    "notes": "Independent HTML/CSS reconstruction of the public preview layout sequence. The template does not reuse source photos or proprietary presentation assets; grayscale photo regions are editable placeholders built at matching layout proportions."
  }
}
