{
  "slug": "midnight-executive",
  "name": "Midnight Executive",
  "tagline": "Midnight executive deck with brass accents, dashboard cards, risk heatmaps, and boardroom-style hierarchy.",
  "mood": [
    "serious",
    "premium",
    "focused",
    "high-stakes"
  ],
  "occasion": [
    "board update",
    "executive presentation",
    "investor update",
    "annual review",
    "strategic review"
  ],
  "tone": [
    "executive",
    "polished",
    "dramatic",
    "authoritative"
  ],
  "formality": "high",
  "density": "medium-high",
  "scheme": "dark",
  "palette": {
    "bg": "#07111F",
    "surface": "#0D1B2E",
    "panel": "#14243A",
    "ink": "#F6F1E7",
    "text": "#D7DEE8",
    "muted": "#8996A8",
    "primary": "#D7B46A",
    "secondary": "#638BFF",
    "tertiary": "#E86E4F",
    "green": "#58C99D",
    "description": "Midnight navy and charcoal surfaces with warm brass accents, soft blue highlights, and crisp ivory type."
  },
  "typography": {
    "display": "Barlow Condensed",
    "body": "Inter",
    "style": "Compressed executive display type with neutral sans body."
  },
  "best_for": "Board updates, investor briefings, high-stakes leadership reviews, and any business narrative that needs to feel serious, premium, and tightly controlled.",
  "avoid_for": "Casual team workshops, playful launches, classroom decks, or content that needs to feel warm and approachable.",
  "slide_count": 8,
  "features": {
    "navigation": true,
    "keyboard_navigation": true,
    "touch_navigation": true,
    "progress_bar": true,
    "slide_counter": true,
    "aspect_ratio": "fullscreen-responsive",
    "format": "single-file-html"
  },
  "layouts": [
    "split-cover",
    "executive-index",
    "kpi-dashboard",
    "decision-brief",
    "risk-heatmap",
    "quote-brief",
    "vertical-timeline",
    "closing"
  ],
  "source_inspiration": {
    "name": "Dark Bold Slides for Executive Presentations",
    "url": "https://gamma.app/templates/categories",
    "notes": "Original HTML template rebuilt from public visual direction only; not a pixel copy and does not reuse source assets."
  }
}
