{
  "slug": "circuit-tech-dark",
  "name": "Circuit Tech Dark",
  "tagline": "Dark technical deck with terminal panels, circuit grids, architecture nodes, and neon system metrics.",
  "mood": [
    "technical",
    "precise",
    "futuristic",
    "energetic"
  ],
  "occasion": [
    "technical roadmap",
    "architecture review",
    "platform pitch",
    "AI product strategy",
    "developer tool launch"
  ],
  "tone": [
    "systematic",
    "sharp",
    "digital",
    "engineering-led"
  ],
  "formality": "medium-high",
  "density": "high",
  "scheme": "dark",
  "palette": {
    "bg": "#050B14",
    "surface": "#081525",
    "panel": "#0D2136",
    "ink": "#F2FBFF",
    "text": "#D4E6F2",
    "muted": "#7F95AA",
    "primary": "#25D7FF",
    "secondary": "#6C5CFF",
    "tertiary": "#17E6A1",
    "green": "#17E6A1",
    "description": "Near-black technical canvas with electric cyan, violet, and mint accents for panels, traces, and system metrics."
  },
  "typography": {
    "display": "IBM Plex Mono",
    "body": "Inter",
    "style": "Monospace headings and clean UI body text for technical precision."
  },
  "best_for": "Technical strategy, platform architecture, AI infrastructure narratives, developer tool launches, and system diagrams that need a dark dashboard feel.",
  "avoid_for": "Warm brand storytelling, people-centric culture decks, or traditional consulting reports.",
  "slide_count": 8,
  "features": {
    "navigation": true,
    "keyboard_navigation": true,
    "touch_navigation": true,
    "progress_bar": true,
    "slide_counter": true,
    "aspect_ratio": "fullscreen-responsive",
    "format": "single-file-html"
  },
  "layouts": [
    "terminal-cover",
    "command-agenda",
    "system-map",
    "stack-layers",
    "metric-console",
    "network-graph",
    "pipeline-roadmap",
    "closing"
  ],
  "source_inspiration": {
    "name": "Tech & Engineering Dark Mode Slide Deck",
    "url": "https://gamma.app/templates/categories",
    "notes": "Original HTML template rebuilt from public visual direction only; not a pixel copy and does not reuse source assets."
  }
}
