{
  "slug": "linear-qbr",
  "name": "Linear QBR",
  "tagline": "Pale pink quarterly review deck with strict navy frames, editorial serif headings, olive accents, and linear report modules.",
  "mood": [
    "minimal",
    "precise",
    "orderly",
    "professional"
  ],
  "occasion": [
    "quarterly business review",
    "board update",
    "operating cadence",
    "portfolio review"
  ],
  "tone": [
    "restrained",
    "linear",
    "clear",
    "formal"
  ],
  "formality": "high",
  "density": "medium-high",
  "palette": {
    "bg": "#F6E5E2",
    "surface": "#F6E5E2",
    "panel": "#F1DCD8",
    "primary": "#2D4F93",
    "accent": "#B6A000",
    "text": "#2D4F93",
    "muted": "#6E642A",
    "line": "#2D4F93",
    "description": "pale pink field with navy linear borders, large blue serif headings, olive-gold accent words, and muted olive body text"
  },
  "typography": {
    "display": "Cormorant Garamond",
    "body": "Inter",
    "style": "high-contrast editorial serif headings with neutral readable body text"
  },
  "scheme": "light",
  "best_for": "Quarterly business reviews, executive operating updates, and reporting decks that need a formal but not overly corporate tone.",
  "avoid_for": "Playful training, dark product pitches, or image-heavy portfolios where strict frames and pale report styling would feel too restrained.",
  "slide_count": 38,
  "features": {
    "navigation": true,
    "keyboard_navigation": true,
    "touch_navigation": true,
    "progress_bar": true,
    "slide_counter": true,
    "aspect_ratio": "fullscreen-responsive",
    "format": "single-file-html",
    "source_preview_slides": 38
  },
  "layouts": [
    "framed-cover",
    "resource-list",
    "center-intro",
    "framed-toc-grid",
    "split-about",
    "metric-row",
    "bar-chart",
    "map-summary",
    "timeline",
    "budget-table",
    "three-column-feedback",
    "risk-opportunity",
    "quote",
    "thanks",
    "report-chart-variants"
  ],
  "source_inspiration": {
    "name": "Slidesgo Linear Quarterly Business Review",
    "url": "https://slidesgo.com/theme/linear-quarterly-business-review",
    "notes": "Independent HTML/CSS reconstruction of the public preview sequence. It follows the source typography, pale background, navy frame rules, olive accent marks, and report-like layout rhythm without reusing source presentation assets."
  }
}
