{
  "slug": "smart-business-report",
  "name": "Smart Business Report",
  "tagline": "Clean AI-era business report with stacked cards, pastel panels, polished status layouts, and SaaS report hierarchy.",
  "mood": [
    "professional",
    "clean",
    "polished",
    "optimistic"
  ],
  "occasion": [
    "marketing status report",
    "business review",
    "quarterly update",
    "SaaS report"
  ],
  "tone": [
    "friendly",
    "clear",
    "businesslike",
    "modern"
  ],
  "formality": "medium",
  "density": "medium",
  "palette": {
    "bg": "#F7FBFE",
    "surface": "#FFFFFF",
    "panel": "#E8F7FF",
    "ink": "#062432",
    "text": "#183544",
    "muted": "#6D7B85",
    "primary": "#45C7F5",
    "secondary": "#8E61FF",
    "tertiary": "#FFCF4A",
    "description": "white and pale blue SaaS surface with cyan buttons, purple panels, and yellow highlight blocks"
  },
  "typography": {
    "display": "Manrope",
    "body": "Inter",
    "style": "polished rounded business sans system"
  },
  "scheme": "light",
  "best_for": "Business updates, marketing status reports, SaaS reviews, and polished internal reporting where friendliness and clarity matter.",
  "avoid_for": "Dark technical demos, luxury editorial work, or highly expressive youth-culture decks.",
  "slide_count": 6,
  "features": {
    "navigation": true,
    "keyboard_navigation": true,
    "touch_navigation": true,
    "progress_bar": true,
    "slide_counter": true,
    "aspect_ratio": "fullscreen-responsive",
    "format": "single-file-html"
  },
  "layouts": [
    "card-stack-cover",
    "status-summary",
    "dashboard-cards",
    "campaign-split",
    "action-plan",
    "closing"
  ],
  "source_inspiration": {
    "name": "Beautiful.ai Presentation Template Gallery",
    "url": "https://www.beautiful.ai/presentations?1e2ac93b_page=2",
    "notes": "Independent HTML/CSS interpretation based on public visual reference; not a pixel copy and does not reuse source assets."
  }
}
