{
  "slug": "bright-organized",
  "name": "Bright Organized",
  "tagline": "Warm white business slides with burgundy headlines and blue, yellow, orange, and green accents for clear structured reporting.",
  "mood": [
    "approachable",
    "organized",
    "businesslike",
    "clear",
    "energetic"
  ],
  "occasion": [
    "business review",
    "company presentation",
    "strategy update",
    "operating plan",
    "team kickoff",
    "marketing plan",
    "training overview",
    "client proposal"
  ],
  "tone": [
    "warm",
    "structured",
    "legible",
    "confident",
    "practical"
  ],
  "formality": "medium",
  "density": "medium-high",
  "scheme": "light",
  "palette": {
    "bg": "#FFF8EC",
    "surface": "#FFFFFF",
    "ink": "#381522",
    "text": "#3B2A2F",
    "text_muted": "#7A6870",
    "blue": "#2364AA",
    "navy": "#17365D",
    "yellow": "#F4B740",
    "orange": "#F26B3A",
    "green": "#2D9A6A",
    "description": "Warm white canvas grounded by deep burgundy headings, with recurring blue, yellow, orange, and green accents for badges, cards, charts, and priority markers."
  },
  "typography": {
    "display": "Sora",
    "body": "Inter",
    "style": "Rounded modern sans pairing; clear business hierarchy with friendly weight and high legibility."
  },
  "best_for": "Business decks that need to feel structured, legible, and approachable without becoming bland: company updates, operating plans, consulting recommendations, team kickoffs, marketing plans, client proposals, and training overviews. Strong when the content includes frameworks, priorities, metrics, and simple charts.",
  "avoid_for": "Very formal board materials that require restraint, luxury editorial narratives, or dark cinematic tech decks. The bright accent system can feel too energetic for sober legal, crisis, or high-stakes finance contexts.",
  "slide_count": 10,
  "features": {
    "navigation": true,
    "keyboard_navigation": true,
    "touch_navigation": true,
    "progress_bar": true,
    "slide_counter": true,
    "aspect_ratio": "fullscreen-responsive",
    "format": "single-file-html"
  },
  "layouts": [
    "cover",
    "agenda",
    "summary-cards",
    "pyramid-framework",
    "feature-grid",
    "priority-matrix",
    "bar-chart",
    "donut-breakdown",
    "roadmap",
    "closing"
  ],
  "source_inspiration": {
    "name": "Bright & Organized Slides for Business Decks",
    "url": "https://gamma.app/templates/company-presentation-template-primer-gxim7cpqfdd3lpq",
    "notes": "Original HTML template rebuilt from public visual description only; not a pixel copy and does not reuse Gamma assets."
  }
}
