{
  "slug": "earthy-handmade",
  "name": "Earthy Handmade",
  "tagline": "Warm tactile deck with paper texture, organic cards, sticker labels, and handmade workshop pacing.",
  "mood": [
    "warm",
    "organic",
    "playful",
    "human"
  ],
  "occasion": [
    "brand manifesto",
    "community workshop",
    "classroom kickoff",
    "creative proposal",
    "nonprofit story"
  ],
  "tone": [
    "handmade",
    "approachable",
    "story-led",
    "soft"
  ],
  "formality": "medium-low",
  "density": "medium",
  "scheme": "light",
  "palette": {
    "bg": "#F7F1E3",
    "surface": "#FFFDF6",
    "panel": "#E7E1C8",
    "ink": "#30402E",
    "text": "#4E5D49",
    "muted": "#7A7D65",
    "primary": "#6C8A4A",
    "secondary": "#D8845B",
    "tertiary": "#E8B84F",
    "green": "#6C8A4A",
    "description": "Warm paper, sage green, terracotta, golden ochre, and ink-green text with tactile cards and soft organic shapes."
  },
  "typography": {
    "display": "Fraunces",
    "body": "Nunito Sans",
    "style": "Soft serif display with rounded body text for a handcrafted feel."
  },
  "best_for": "Brand manifestos, workshops, classroom kickoffs, nonprofit storytelling, and community or creative decks that should feel human and tactile.",
  "avoid_for": "Formal investor reports, technical architecture reviews, or high-stakes executive materials.",
  "slide_count": 8,
  "features": {
    "navigation": true,
    "keyboard_navigation": true,
    "touch_navigation": true,
    "progress_bar": true,
    "slide_counter": true,
    "aspect_ratio": "fullscreen-responsive",
    "format": "single-file-html"
  },
  "layouts": [
    "organic-cover",
    "note-agenda",
    "story-cards",
    "circle-process",
    "workshop-board",
    "impact-garden",
    "string-timeline",
    "closing"
  ],
  "source_inspiration": {
    "name": "Earthy Handmade Slides for Creative Brands",
    "url": "https://gamma.app/templates/categories",
    "notes": "Original HTML template rebuilt from public visual direction only; not a pixel copy and does not reuse source assets."
  }
}
