{
  "slug": "grant-proposal",
  "name": "Grant Proposal",
  "tagline": "Formal grant proposal deck with document-like sections, navy and gold hierarchy, budget tables, and evidence-first layouts.",
  "mood": [
    "formal",
    "credible",
    "measured",
    "institutional"
  ],
  "occasion": [
    "grant proposal",
    "foundation pitch",
    "research funding request",
    "program application"
  ],
  "tone": [
    "serious",
    "documented",
    "structured",
    "evidence-led"
  ],
  "formality": "high",
  "density": "high",
  "palette": {
    "bg": "#F6F3EA",
    "surface": "#FFFFFF",
    "panel": "#D9C79D",
    "primary": "#10243E",
    "accent": "#B8893A",
    "text": "#10243E",
    "muted": "#4E5561",
    "line": "#B8893A",
    "description": "Warm document canvas with navy title blocks, gold rules, white paper panels, and muted institutional copy."
  },
  "typography": {
    "display": "Libre Baskerville",
    "body": "Inter",
    "style": "Formal serif display with neutral sans body for dense proposal copy and tables."
  },
  "scheme": "light",
  "best_for": "Grant proposals, foundation pitches, nonprofit funding requests, academic funding applications, and evidence-heavy program proposals.",
  "avoid_for": "Playful creative campaigns, lightweight social decks, or expressive brand pitches where formal document structure would feel too rigid.",
  "slide_count": 12,
  "features": {
    "navigation": true,
    "keyboard_navigation": true,
    "touch_navigation": true,
    "progress_bar": true,
    "slide_counter": true,
    "aspect_ratio": "fixed-16-9-browser-openable",
    "format": "single-file-html",
    "source_preview_slides": 12
  },
  "layouts": [
    "formal-cover",
    "executive-letter",
    "need-table",
    "logic-model",
    "evidence-panels",
    "implementation-plan",
    "budget-summary",
    "evaluation-plan",
    "risk-controls",
    "partnership-grid",
    "sustainability-plan",
    "closing-ask"
  ],
  "content_limits": {
    "max_title_chars": 86,
    "max_subtitle_chars": 190,
    "max_body_chars_per_slide": 760,
    "max_bullets": 7,
    "max_cards": 4,
    "recommended_slide_count_min": 8,
    "recommended_slide_count_max": 14
  },
  "source_inspiration": {
    "name": "Presentations.ai Grant Proposal Template",
    "url": "https://www.presentations.ai/presentation-templates/grant-proposal",
    "notes": "Independent page-by-page HTML/CSS reconstruction inspired by the public grant proposal template page: document-like structure, business/formal tone, navy and gold hierarchy, tables, logic model, evidence panels, evaluation plan, risk controls, and funding ask. It does not reuse source slide assets."
  }
}
