{
  "slug": "neon-grid-agency",
  "name": "Neon Grid Agency",
  "tagline": "Cyber agency template with black surfaces, neon frames, geometric signage, bright palette chips, and model-agency energy.",
  "mood": [
    "bold",
    "electric",
    "creative",
    "youthful"
  ],
  "occasion": [
    "model agency pitch",
    "creative studio proposal",
    "campaign launch",
    "youth brand deck"
  ],
  "tone": [
    "neon",
    "graphic",
    "street",
    "energetic"
  ],
  "formality": "low",
  "density": "medium",
  "palette": {
    "bg": "#080812",
    "surface": "#161627",
    "panel": "#242347",
    "ink": "#FFFFFF",
    "text": "#F3F0FF",
    "muted": "#B8B0D8",
    "primary": "#33FFE1",
    "secondary": "#F53BFF",
    "tertiary": "#FFE74A",
    "description": "black cyber grid with cyan, magenta, yellow, orange, and violet neon accents"
  },
  "typography": {
    "display": "Chakra Petch",
    "body": "Inter",
    "style": "techno geometric agency display with readable sans body"
  },
  "scheme": "dark",
  "best_for": "Creative agency pitches, model/talent decks, neon campaign concepts, and youth-focused brand presentations.",
  "avoid_for": "Board updates, clinical education, formal research, or restrained luxury editorial.",
  "slide_count": 6,
  "features": {
    "navigation": true,
    "keyboard_navigation": true,
    "touch_navigation": true,
    "progress_bar": true,
    "slide_counter": true,
    "aspect_ratio": "fullscreen-responsive",
    "format": "single-file-html"
  },
  "layouts": [
    "neon-agency-cover",
    "palette-board",
    "talent-grid",
    "campaign-system",
    "activation-roadmap",
    "closing"
  ],
  "source_inspiration": {
    "name": "Slidesgo Neon Gallery",
    "url": "https://slidesgo.com/neon",
    "notes": "Independent HTML/CSS interpretation based on public visual reference; not a pixel copy and does not reuse source assets."
  }
}
