{
  "slug": "neon-night-pitch",
  "name": "Neon Night Pitch",
  "tagline": "Illustrative neon pitch deck with glowing outline type, youth-culture doodles, purple stage backgrounds, and poster-like title slides.",
  "mood": [
    "energetic",
    "playful",
    "nightlife",
    "creative"
  ],
  "occasion": [
    "event pitch",
    "creator deck",
    "youth brand",
    "music or culture proposal"
  ],
  "tone": [
    "expressive",
    "loud",
    "illustrative",
    "pop"
  ],
  "formality": "low",
  "density": "medium",
  "palette": {
    "bg": "#070A26",
    "surface": "#11153F",
    "panel": "#24115C",
    "ink": "#FFE7FF",
    "text": "#FFFFFF",
    "muted": "#BFB5E8",
    "primary": "#FFB22E",
    "secondary": "#61F2D0",
    "tertiary": "#FF5CD6",
    "description": "deep navy and purple stage with orange, mint, and pink neon line work"
  },
  "typography": {
    "display": "Bungee Outline",
    "body": "Poppins",
    "style": "neon outline display with rounded pop body text"
  },
  "scheme": "dark",
  "best_for": "Event pitches, creator decks, nightlife concepts, youth brands, and decks that should feel loud, poster-like, and memorable.",
  "avoid_for": "Executive reports, sober B2B decks, medical/science decks, or restrained premium positioning.",
  "slide_count": 6,
  "features": {
    "navigation": true,
    "keyboard_navigation": true,
    "touch_navigation": true,
    "progress_bar": true,
    "slide_counter": true,
    "aspect_ratio": "fullscreen-responsive",
    "format": "single-file-html"
  },
  "layouts": [
    "neon-poster-cover",
    "doodle-agenda",
    "audience-cards",
    "stage-split",
    "glow-roadmap",
    "closing"
  ],
  "source_inspiration": {
    "name": "SlidesCarnival Minimalistic Neon Pitch Deck",
    "url": "https://www.slidescarnival.com/template/neon-pitch-deck/52753",
    "notes": "Independent HTML/CSS interpretation based on public visual reference; not a pixel copy and does not reuse source assets."
  }
}
