{
  "slug": "retro-analog-brutalist",
  "name": "Retro Analog Brutalist",
  "tagline": "Retro-tech brutalist deck with electric blue, acid yellow, blocky panels, glow effects, and deliberately unusual compositions.",
  "mood": [
    "bold",
    "weird",
    "retro",
    "energetic"
  ],
  "occasion": [
    "creative tech pitch",
    "digital marketing deck",
    "portfolio",
    "product launch"
  ],
  "tone": [
    "brutalist",
    "high-contrast",
    "experimental",
    "graphic"
  ],
  "formality": "medium-low",
  "density": "high",
  "palette": {
    "bg": "#050505",
    "surface": "#FFFFFF",
    "panel": "#111111",
    "primary": "#145CFF",
    "accent": "#F8E436",
    "text": "#FFFFFF",
    "muted": "#8D8D8D",
    "line": "#F8E436",
    "description": "Black base with electric blue, acid yellow, white panels, and muted gray notes."
  },
  "typography": {
    "display": "Space Mono",
    "body": "Inter",
    "style": "Vintage computer-like monospace display with neutral sans body for compact technical copy."
  },
  "scheme": "mixed",
  "best_for": "Creative tech launches, digital marketing pitches, portfolio decks, and product stories that should feel bold, strange, retro, and high contrast.",
  "avoid_for": "Conservative board reporting, quiet research synthesis, or any setting where brutalist contrast would distract from the message.",
  "slide_count": 15,
  "features": {
    "navigation": true,
    "keyboard_navigation": true,
    "touch_navigation": true,
    "progress_bar": true,
    "slide_counter": true,
    "aspect_ratio": "fixed-16-9-browser-openable",
    "format": "single-file-html",
    "source_preview_slides": 15
  },
  "layouts": [
    "terminal-cover",
    "resource-grid",
    "brutalist-split",
    "machine-stats",
    "system-map",
    "command-list",
    "signal-chart",
    "image-blocks",
    "asymmetric-modules",
    "glow-quote",
    "diagonal-process",
    "team-grid",
    "style-sheet",
    "poster-close",
    "boot-complete"
  ],
  "content_limits": {
    "max_title_chars": 72,
    "max_subtitle_chars": 160,
    "max_body_chars_per_slide": 620,
    "max_bullets": 6,
    "max_cards": 6,
    "recommended_slide_count_min": 10,
    "recommended_slide_count_max": 18
  },
  "source_inspiration": {
    "name": "Plus AI Retro Analog Presentation Template",
    "url": "https://plusai.com/br/templates/retro-analog",
    "notes": "Independent page-by-page HTML/CSS reconstruction of the public preview style: black, blue, yellow, white, glow effects, block panels, terminal typography, and non-traditional compositions. It does not reuse source slide assets."
  }
}
