{
  "slug": "editorial-luxury",
  "name": "Editorial Luxury",
  "tagline": "Premium editorial deck with magazine spreads, oversized serif type, image frames, rules, and restrained gold accents.",
  "mood": [
    "refined",
    "editorial",
    "premium",
    "composed"
  ],
  "occasion": [
    "brand strategy",
    "portfolio presentation",
    "creative direction",
    "luxury pitch",
    "launch narrative"
  ],
  "tone": [
    "luxury",
    "minimal",
    "fashion-like",
    "art-directed"
  ],
  "formality": "medium-high",
  "density": "medium-low",
  "scheme": "light",
  "palette": {
    "bg": "#F3F0EA",
    "surface": "#FFFFFF",
    "panel": "#E3DED5",
    "ink": "#111111",
    "text": "#33302B",
    "muted": "#77706A",
    "primary": "#111111",
    "secondary": "#B08D57",
    "tertiary": "#D9FF5A",
    "green": "#6E8B68",
    "description": "Soft stone background with black editorial type, ivory panels, muted gold, and occasional acidic chartreuse accents."
  },
  "typography": {
    "display": "Playfair Display",
    "body": "Inter",
    "style": "High-contrast editorial serif with restrained modern sans."
  },
  "best_for": "Premium brand strategy, portfolio presentations, creative direction, luxury pitches, and decks where restraint and taste matter more than data density.",
  "avoid_for": "Dense operating reviews, technical system diagrams, or casual team updates that need speed over polish.",
  "slide_count": 8,
  "content_limits": {
    "max_title_chars": 34,
    "max_subtitle_chars": 95,
    "max_body_chars_per_slide": 360,
    "max_bullets": 3,
    "max_cards": 4,
    "recommended_slide_count_min": 6,
    "recommended_slide_count_max": 10
  },
  "features": {
    "navigation": true,
    "keyboard_navigation": true,
    "touch_navigation": true,
    "progress_bar": true,
    "slide_counter": true,
    "aspect_ratio": "fullscreen-responsive",
    "format": "single-file-html"
  },
  "layouts": [
    "magazine-cover",
    "contents-spread",
    "image-grid",
    "editorial-quote",
    "positioning-table",
    "art-direction-board",
    "vertical-index",
    "closing"
  ],
  "source_inspiration": {
    "name": "Editorial Slides for Fashion & Luxury Brands",
    "url": "https://gamma.app/templates/categories",
    "notes": "Original HTML template rebuilt from public visual direction only; not a pixel copy and does not reuse source assets."
  }
}
