{
  "slug": "clinical-infographic",
  "name": "Clinical Infographic",
  "tagline": "White medical infographic template with line icons, circular callouts, blue accents, and clean research diagrams.",
  "mood": [
    "clinical",
    "clear",
    "educational",
    "trustworthy"
  ],
  "occasion": [
    "medical report",
    "research explanation",
    "clinical training",
    "science briefing"
  ],
  "tone": [
    "simple",
    "informative",
    "neutral",
    "diagrammatic"
  ],
  "formality": "medium-high",
  "density": "medium-high",
  "palette": {
    "bg": "#FFFFFF",
    "surface": "#F7FAFC",
    "panel": "#EAF6FF",
    "ink": "#111111",
    "text": "#2A2F36",
    "muted": "#637083",
    "primary": "#59BFE8",
    "secondary": "#111111",
    "tertiary": "#9BDD72",
    "description": "white clinical surface with black line work, pale blue panels, and restrained health green highlights"
  },
  "typography": {
    "display": "Nunito Sans",
    "body": "Inter",
    "style": "rounded clinical sans with neutral body text"
  },
  "scheme": "light",
  "best_for": "Medical explainers, health reports, research summaries, training materials, and decks where clarity matters more than drama.",
  "avoid_for": "Luxury brand decks, dark keynote stages, or highly emotional storytelling.",
  "slide_count": 6,
  "features": {
    "navigation": true,
    "keyboard_navigation": true,
    "touch_navigation": true,
    "progress_bar": true,
    "slide_counter": true,
    "aspect_ratio": "fullscreen-responsive",
    "format": "single-file-html"
  },
  "layouts": [
    "medical-cover",
    "icon-orbit",
    "infographic-grid",
    "process-diagram",
    "comparison-table",
    "closing"
  ],
  "source_inspiration": {
    "name": "Slidesgo Medical Infographics",
    "url": "https://slidesgo.com/theme/medical-infographics-simple",
    "notes": "Independent HTML/CSS interpretation based on public visual reference; not a pixel copy and does not reuse source assets."
  }
}
