{
  "slug": "glass-ux-studio",
  "name": "Glass UX Studio",
  "tagline": "Dark gradient UX deck with glowing glass panels, app-flow cards, soft cyan UI elements, and product walkthrough layouts.",
  "mood": [
    "futuristic",
    "smooth",
    "product-led",
    "immersive"
  ],
  "occasion": [
    "UX case study",
    "product walkthrough",
    "app concept",
    "innovation pitch"
  ],
  "tone": [
    "sleek",
    "digital",
    "gradient",
    "experiential"
  ],
  "formality": "medium",
  "density": "medium",
  "palette": {
    "bg": "#07102A",
    "surface": "rgba(255,255,255,.08)",
    "panel": "rgba(91,235,255,.12)",
    "ink": "#F8FCFF",
    "text": "#E1F3FF",
    "muted": "#8EB2C6",
    "primary": "#34E7F7",
    "description": "deep blue gradient with translucent glass cards, cyan glow, and pale interface text"
  },
  "typography": {
    "display": "Outfit",
    "body": "Inter",
    "style": "sleek product sans with rounded digital body text"
  },
  "scheme": "dark",
  "best_for": "UX case studies, product walkthroughs, app concepts, and innovation pitches where the deck should feel like a digital product demo.",
  "avoid_for": "Traditional consulting, print-like brand editorial, or clinical education decks.",
  "slide_count": 6,
  "features": {
    "navigation": true,
    "keyboard_navigation": true,
    "touch_navigation": true,
    "progress_bar": true,
    "slide_counter": true,
    "aspect_ratio": "fullscreen-responsive",
    "format": "single-file-html"
  },
  "layouts": [
    "glass-product-cover",
    "flow-map",
    "experience-table",
    "device-showcase",
    "research-insights",
    "closing"
  ],
  "source_inspiration": {
    "name": "Slidesgo User Experience Studio",
    "url": "https://slidesgo.com/theme/user-experience-studio",
    "notes": "Independent HTML/CSS interpretation based on public visual reference; not a pixel copy and does not reuse source assets."
  }
}
