{
  "slug": "matisse-collage",
  "name": "Matisse Collage",
  "tagline": "Artful paper-cut deck with cream canvas, organic cutouts, gallery spacing, and calm color-block composition.",
  "mood": [
    "artful",
    "gentle",
    "creative",
    "curated"
  ],
  "occasion": [
    "portfolio",
    "art class",
    "creative direction",
    "brand manifesto"
  ],
  "tone": [
    "warm",
    "gallery-like",
    "organic",
    "expressive"
  ],
  "formality": "medium",
  "density": "medium-low",
  "palette": {
    "bg": "#F7ECD8",
    "surface": "#F6C648",
    "panel": "#FFFFFF",
    "primary": "#2D2FAE",
    "accent": "#E3533D",
    "text": "#2D2FAE",
    "muted": "#5B3D6B",
    "line": "#2D2FAE",
    "description": "Warm cream canvas with Matisse-inspired blue, red, yellow, pink, green, and black cut-paper shapes."
  },
  "typography": {
    "display": "Cormorant Garamond",
    "body": "Inter",
    "style": "Elegant blue serif display type with restrained sans body, matching the source art-school tone."
  },
  "scheme": "light",
  "best_for": "Portfolio, art education, creative direction, brand manifesto, and workshop decks that should feel artful, gentle, and handmade.",
  "avoid_for": "Dense financial reports, dark technical dashboards, or high-pressure sales decks where the organic art language would feel too soft.",
  "slide_count": 15,
  "features": {
    "navigation": true,
    "keyboard_navigation": true,
    "touch_navigation": true,
    "progress_bar": true,
    "slide_counter": true,
    "aspect_ratio": "fixed-16-9-browser-openable",
    "format": "single-file-html",
    "source_preview_slides": 15
  },
  "layouts": [
    "cutout-cover",
    "how-to-split",
    "collage-agenda",
    "profile-split",
    "topic-icons",
    "quote-dancer",
    "gallery-wall",
    "organic-timeline",
    "soft-metrics",
    "before-after",
    "activity-cards",
    "photo-ornament",
    "resource-grid",
    "credits-page",
    "cutout-close"
  ],
  "content_limits": {
    "max_title_chars": 64,
    "max_subtitle_chars": 150,
    "max_body_chars_per_slide": 420,
    "max_bullets": 4,
    "max_cards": 4,
    "recommended_slide_count_min": 9,
    "recommended_slide_count_max": 15
  },
  "source_inspiration": {
    "name": "SlidesCarnival Matisse Art Style",
    "url": "https://www.slidescarnival.com/template/matisse-style/33951",
    "notes": "Independent page-by-page HTML/CSS reconstruction of the public preview sequence: cream canvas, blue serif titles, organic cutouts, botanical forms, dancer silhouettes, pink/yellow blocks, and centered gallery spacing. It does not reuse source slide assets."
  }
}
