{
  "slug": "dark-minimal-ui",
  "name": "Dark Minimal UI",
  "tagline": "Dark pitch deck with wireframe windows, cyan UI outlines, monospace headings, and compact product-flow layouts.",
  "mood": [
    "technical",
    "focused",
    "minimal",
    "neon"
  ],
  "occasion": [
    "startup pitch",
    "product concept",
    "UI proposal",
    "technology demo"
  ],
  "tone": [
    "digital",
    "precise",
    "lean",
    "interface-led"
  ],
  "formality": "medium",
  "density": "medium-high",
  "palette": {
    "bg": "#050508",
    "surface": "#252733",
    "panel": "#303341",
    "ink": "#F8F8F2",
    "text": "#D7D7D0",
    "muted": "#9AA0A8",
    "primary": "#73F2F2",
    "description": "black canvas with charcoal UI panels, cyan wireframe lines, and compact interface accents"
  },
  "typography": {
    "display": "Space Mono",
    "body": "Inter",
    "style": "monospace product display with clean UI body text"
  },
  "scheme": "dark",
  "best_for": "Technology pitches, UI product demos, founder decks, and concepts that should feel like an interactive interface mockup.",
  "avoid_for": "Warm storytelling, luxury editorial work, or formal reports that need traditional authority.",
  "slide_count": 6,
  "features": {
    "navigation": true,
    "keyboard_navigation": true,
    "touch_navigation": true,
    "progress_bar": true,
    "slide_counter": true,
    "aspect_ratio": "fullscreen-responsive",
    "format": "single-file-html"
  },
  "layouts": [
    "wireframe-cover",
    "terminal-agenda",
    "metric-ui-grid",
    "interface-split",
    "workflow-lanes",
    "closing"
  ],
  "source_inspiration": {
    "name": "Slidesgo Dark Minimal UI Pitch Deck",
    "url": "https://slidesgo.com/theme/dark-minimal-ui-pitch-deck",
    "notes": "Independent HTML/CSS interpretation based on public visual reference; not a pixel copy and does not reuse source assets."
  }
}
